word,translation,sentence
everybody,pron.每个人,Everybody enjoyed the party.
lay,v.放置,She laid the book on the table.
beat,v.打败,Our team beat theirs in the final match.
scene,n.场景,The movie's opening scene was very exciting.
eight,num.八,There are eight apples in the basket.
skill,n.技能,Good communication is an important skill.
seat,n.座位,He took a seat by the window.
thought,n.想法,She shared her thoughts about the project.
argue,v.争论,They often argue about small things.
fly,v.飞翔,Birds fly in the sky.
simple,adj.简单的,The test was so simple that everyone passed.
simple,adj.朴素的,She wore a simple dress.
protect,v.保护,A good jacket will protect you from the cold.
success,n.成功,Hard work is the key to success.
finish,v.完成,He finished his homework before dinner.
lack,v.缺乏,She lacks confidence when speaking in public.
lack,n.缺少,The lack of sleep made him feel tired.
degree,n.学位,She earned a degree in biology.
degree,n.程度,The problem has reached a serious degree.
growth,n.增长,The company showed strong growth last year.
limit,n.限制,There is a speed limit on this road.
limit,v.限制,You should limit your screen time.
stage,n.阶段,She is in the final stage of the project.
stage,n.舞台,He felt nervous on stage.
knowledge,n.知识,His knowledge of history is impressive.
brown,adj.棕色的,She has brown eyes.
whatever,pron.无论什么,Take whatever you need.
recognize,v.认出,I recognized her from a distance.
recognize,v.承认,The government recognized the need for change.
training,n.训练,She is in training for the marathon.
serious,adj.严重的,It was a serious accident.
serious,adj.认真的,He is a serious student.
character,n.性格,She has a kind and friendly character.
character,n.角色,He plays the main character in the movie.
meeting,n.会议,We have a meeting at 10 a.m.
loss,n.失去,He felt sad about the loss of his dog.
touch,v.触摸,Don't touch the hot pan.
touch,n.联系,We keep in touch through emails.
influence,n.影响,His parents had a big influence on him.
influence,v.影响,The weather can influence our mood.
accept,v.接受,She accepted the job offer.
direct,adj.直接的,He gave me a direct answer.
direct,v.指挥,She directed the new movie.
prepare,v.准备,She needs time to prepare for the exam.
dress,v.穿衣服,She took a few minutes to dress before leaving.
dress,n.连衣裙,She bought a beautiful red dress.
fast,adj.快速的,He is a fast runner.
fast,adv.迅速地,She finished the work very fast.
wind,n.风,The wind is very strong today.
wind,v.蜿蜒,The river winds through the valley.
miss,v.错过,I missed the last bus home.
miss,v.想念,She really misses her family.
section,n.部分,Please read the first section of the book.
station,n.车站,He is waiting at the train station.
professor,n.教授,She is a professor of physics at the university.
potential,n.潜力,He has great potential in music.
tonight,adv.今晚,Are you free tonight?
sister,n.姐妹,My sister is two years younger than me.
heat,n.热量,The heat in summer is unbearable.
television,n.电视,We watched a movie on television last night.
gun,n.枪,The police found a loaded gun in his bag.
environment,n.环境,We should protect the environment.
fail,v.失败,He failed the math test.
compare,v.比较,You should compare prices before buying a car.
message,n.信息,He sent me a message this morning.
sex,n.性别,Please write your name and sex on the form.
ride,v.骑,She loves to ride her bicycle in the park.
ride,v.乘坐,They decided to ride the bus to work.
authority,n.权威,The teacher has the authority to make the final decision.
authority,n.当局,The local authority provided the necessary support during the crisis.
crime,n.犯罪,Stealing is a crime.
fish,n.鱼,We caught many fish during our trip.
fish,v.捕鱼,They went to fish by the river.
arrive,v.到达,The train will arrive at 5 PM.
worry,v.担心,She started to worry about the test results.
worry,n.担忧,He expressed his worry about the situation.
shake,v.摇动,He will shake the bottle to mix the ingredients.
hang,v.悬挂,The clothes are hanging on the line.
leg,n.腿,He broke his leg while playing football.
example,n.例子,This is a good example of how to solve the problem.
operation,n.操作,The operation of the machine is simple.
operation,n.手术,He needs an operation to fix his injury.
lawyer,n.律师,She hired a lawyer to help with the case.
notice,n.通知,She put a notice on the door about the change in hours.
notice,v.注意到,Did you notice the beautiful painting on the wall?
feeling,n.感觉,She had a strange feeling that something was wrong.
feeling,n.情感,He expressed his feelings through music.
review,v.复习,Students should review their notes before the exam.
review,n.评论,The movie received a great review from the critic.
strike,v.罢工,The workers decided to strike for better wages.
strike,n.打击,"The team's strike was successful, and they won the game."
commercial,adj.商业的,He works in the commercial sector of the company.
commercial,n.广告,The TV commercial was very popular.
district,n.地区,She lives in a quiet district of the city.
nice,adj.友好的,He is a nice person to work with.
network,n.网络,The company has a large network of clients.
network,n.联系,She has built a strong professional network.
religious,adj.宗教的,She comes from a religious family.
religious,adj.虔诚的,He is very religious and prays every day.
gain,v.获得,She hopes to gain some experience during the internship.
gain,n.收益,The company saw a gain in profits last year.
mountain,n.山,We hiked up the mountain for hours.
mountain,n.大量,He has a mountain of work to do.
various,adj.多种多样的,There are various ways to solve the problem.
video,n.视频,He watched a funny video on YouTube.
club,n.俱乐部,He joined a sports club after school.
manager,n.管理员,He is the manager of the department.
sun,n.太阳,The sun was shining brightly in the sky.
sun,n.阳光,We sat in the warm sun.
song,n.歌曲,She sang her favorite song at the concert.
train,n.火车,I took the train to the city yesterday.
train,v.训练,The coach will train the team for the competition.
thousand,num.一千,There are a thousand students in the school.
associate,v.联想,She associates the smell of cookies with her grandmother's house.
associate,n.同事,He is my associate at work.
indeed,adv.确实,"Indeed, she is one of the best students in the class."
track,n.轨道,The train runs on the track.
theory,n.理论,His theory about the universe is quite complicated.
wish,v.希望,I wish to travel the world one day.
wish,n.愿望,My biggest wish is to become a doctor.
clearly,adv.清楚地,She explained the concept clearly to the students.
trip,n.旅行,We are planning a trip to the beach next month.
trip,v.绊倒,She tripped over the uneven pavement.
forget,v.忘记,Please don't forget to bring your homework.
living,adj.活着的,She is still living in the same house.
living,n.生计,He earns a living by selling books.
camera,n.照相机,She brought her camera to capture the beautiful scenery.
remove,v.移除,Please remove your shoes before entering the house.
chair,n.椅子,He sat down on the chair and began to read.
truth,n.真相,"She always tells the truth, no matter how hard it is."
mention,v.提到,He forgot to mention the meeting time.
cell,n.细胞,The human body is made up of millions of cells.
roll,v.滚动,The ball started to roll down the hill.
expert,n.专家,She is an expert in ancient history.
bar,n.酒吧,They decided to meet at the bar after work.
date,n.日期,What is the date of your birthday?
ten,num.十,There are ten apples in the basket.
trouble,n.麻烦,He got into trouble for being late.
legal,adj.合法的,It is not legal to park here.
shoulder,n.肩膀,She patted him on the shoulder to comfort him.
debate,n.辩论,The debate on climate change was very intense.
senior,adj.年长的,He is a senior member of the team.
ball,n.球,The children were playing with a ball in the park.
wide,adj.宽的,The river is too wide to swim across.
affect,v.影响,The weather can affect your mood.
discuss,v.讨论,Let's discuss the plan for the trip.
enjoy,v.享受,She enjoys reading books in her free time.
specific,adj.具体的,Can you give me a specific example?
entire,adj.整个的,He ate the entire pizza by himself.
stick,v.粘住,The glue will stick the paper to the wall.
prove,v.证明,She wants to prove that her theory is correct.
card,n.卡片,He sent her a birthday card.
trial,n.试验,The new drug is still in the trial phase.
main,adj.主要的,The main reason for his success is hard work.
union,n.联合,The union of the two companies created a powerful business.
treat,v.对待,You should treat others with kindness.
shape,n.形状,The shape of the box is rectangular.
adult,n.成年人,Children must be accompanied by an adult.
clean,adj.干净的,Please keep your room clean.
yourself,pron.你自己,You should take care of yourself.
candidate,n.候选人,There are three candidates for the position.
imagine,v.想象,Can you imagine living on the moon?
search,v.搜索,He used the internet to search for information.
block,n.街区,The store is just two blocks away.
onto,prep.到...上,The cat jumped onto the table.
island,n.岛屿,They spent their vacation on a beautiful island.
edge,n.边缘,Be careful not to stand too close to the edge of the cliff.
memory,n.记忆,She has a good memory for names.
promise,n.承诺,He made a promise to help her with the project.
spot,n.地点,This is the spot where we first met.
huge,adj.巨大的,They live in a huge house.
traditional,adj.传统的,We had a traditional Thanksgiving dinner.
method,n.方法,She has a unique method of teaching.
weight,n.重量,The weight of the package is 5 kilograms.
avoid,v.避免,He tried to avoid answering the question.
radio,n.收音机,She listens to the news on the radio every morning.
conduct,v.进行,The scientists conducted an experiment to test their theory.
statement,n.声明,The company issued a statement about the new policy.
access,n.进入,The building has access for wheelchair users.
below,prep.在...下面,The temperature dropped below freezing last night.
army,n.军队,He served in the army for ten years.
apply,v.申请,She decided to apply for the job.
tie,v.系,He helped her tie the ribbon around the gift box.
finger,n.手指,She pointed at the map with her finger.
institution,n.机构,The university is one of the oldest educational institutions in the country.
committee,n.委员会,The committee meets every month to discuss important issues.
respond,v.回应,She quickly responded to the email with all the necessary details.
reform,v.改革,The government plans to reform the healthcare system next year.
peace,n.和平,"After years of conflict, the country finally achieved peace."
popular,adj.流行的,This song is very popular among teenagers.
style,n.风格,Her writing style is unique and easily recognizable.
skin,n.皮肤,She has very sensitive skin that gets irritated easily.
credit,n.信用,"He has good credit, so he was able to get a loan easily."
pain,n.疼痛,She felt a sharp pain in her knee after the fall.
bear,v.忍受,I can't bear the noise from the construction site anymore.
production,n.生产,The factory increased its production to meet the growing demand.
politics,n.政治,He has always been interested in politics and current affairs.
count,v.数数,Can you count how many apples are in the basket?
surface,n.表面,The surface of the table was smooth and shiny.
sing,v.唱歌,She loves to sing in the shower every morning.
budget,n.预算,The company had to cut its budget due to financial difficulties.
stare,v.盯着看,She stared at the painting for a long time.
somebody,n.某人,Somebody left their umbrella in the office.
perform,v.表演,The band will perform at the concert tonight.
perform,v.执行,The surgeon will perform the operation tomorrow.
direction,n.方向,He walked in the direction of the park.
direction,n.指示,Follow the directions on the package carefully.
throughout,prep.遍及,The news spread throughout the town quickly.
contain,v.包含,This box contains all the necessary tools.
bag,n.包,She carried a small bag with her essentials.
editor,n.编辑,The editor reviewed the article before publication.
target,n.目标,The company set a new sales target for the year.
conference,n.会议,They attended a conference on climate change.
comment,n.评论,She made a positive comment about the new policy.
mouth,n.嘴,He opened his mouth to speak but hesitated.
evening,n.晚上,We usually go for a walk in the evening.
manage,v.管理,She manages a team of ten people at work.
manage,v.设法,He managed to finish the project on time.
unit,n.单元,This apartment has two bedrooms and a living unit.
please,v.使高兴,The gift will please her for sure.
cross,v.穿过,Be careful when you cross the street.
respect,n.尊重,He has a lot of respect for his teachers.
struggle,v.挣扎,He struggled to lift the heavy box.
struggle,v.努力, She struggled to pass the exam.
necessary,adj.必要的, It is necessary to drink water every day.
soldier,n.士兵,The soldier bravely defended his country.
ship,n.船,The ship sailed across the ocean.
ship,v.运送,They will ship the package tomorrow.
tough,adj.艰难的,It was a tough decision to make.
tough,adj.坚强的,She is a tough woman who never gives up.
improve,v.提高,Reading books can improve your vocabulary.
pattern,n.模式,He noticed a pattern in her behavior.
reflect,v.反映,His words reflect his true feelings.
reflect,v.反射,The mirror reflects light.
beautiful,adj.美丽的,The sunset looks beautiful.
discover,v.发现,Scientists discovered a new planet.
worth,adj.值得的,This book is worth reading.
fat,adj.胖的,The cat became fat after eating too much.
sea,n.海洋, We swam in the sea during our vacation.
object,n.物体,The strange object was floating in the sky.
object,v.反对,He objected to the new rules.
museum,n.博物馆,We visited a history museum yesterday.
exercise,n.锻炼,Regular exercise keeps you healthy.
exercise,v.练习,You should exercise speaking English every day.
file,n.文件,She saved the file on her computer.
file,v.归档,He filed the papers in the cabinet.
cancer,n.癌症,Smoking increases the risk of cancer.
purpose,n.目的,The purpose of this meeting is to discuss our future plans.
mass,n.大量,There was a mass of people at the concert.
yard,n.院子,The kids are playing in the yard.
fit,adj.合适的,These shoes fit me well.
justice,n.正义,People want justice for the victims.
hotel,n.酒店,We stayed at a five-star hotel.
owner,n.主人,The owner of the shop is very friendly.
dance,v.跳舞,They love to dance to the music.
machine,n.机器,This washing machine is very easy to use.
discussion,n.讨论,We had a long discussion about the project.
kitchen,n.厨房,She is cooking in the kitchen.
magazine,n.杂志,She bought a fashion magazine.
task,n.任务,My task is to finish this report by Friday.
relate,v.与……相关,His problems relate to his childhood.
partner,n.伙伴,He is my business partner.
hurt,v.伤害,He hurt his leg while playing soccer.
heavy,adj.沉重的,This box is too heavy to carry.
garden,n.花园,They have a beautiful garden.
exist,v.存在,Does life exist on other planets?
gas,n.气体,Oxygen is an important gas for life.
gas,n.汽油,We need to stop and get some gas.
marriage,n.婚姻,Their marriage lasted for 50 years.
violence,n.暴力,The movie contains a lot of violence.
reality,n.现实,He needs to face reality.
except,prep.除了,Everyone came except John.
fan,n.风扇,"Turn on the fan, it's too hot in here."
fan,n.粉丝,She is a big fan of that singer.
slow,adj.慢的,The internet is very slow today.
collection,n.收藏,She has a large collection of old coins.
modern,adj.现代的,This house has a modern design.
safe,adj.安全的,This neighborhood is very safe.
agent,n.代理人,She works as a travel agent.
cool,adj.凉爽的,The breeze feels cool in the evening.
cool,adj.酷的,His new jacket looks really cool.
generation,n.一代人,Each generation has its own culture.
wood,n.木材,This table is made of wood.
supply,n.供应,The water supply was cut off.
cry,v.哭泣,The baby started to cry.
camp,n.营地,We set up a camp near the lake.
hall,n.大厅,The meeting will be held in the main hall.
tend,v.倾向于,She tends to wake up early.
tend,v.照顾,He tends to his sick mother.
interesting,adj.有趣的,This book is very interesting.
capital,n.首都,Paris is the capital of France.
capital,n.资金,He invested a lot of capital in the project.
guard,n.警卫,A guard stood at the entrance.
guard,v.守卫,The dog guards the house at night.
handle,v.处理,She knows how to handle difficult situations.
handle,n.把手,The door has a silver handle.
battle,n.战斗,The soldiers fought a fierce battle.
battle,v.斗争,He battled against the disease for years.
whom,pron.谁（宾格）,Whom did you see at the party?
painting,n.绘画,This painting is very beautiful.
dinner,n.晚餐,We had dinner at a nice restaurant.
bottom,n.底部,There is a message at the bottom of the page.
scientist,n.科学家,She is a famous scientist in the field of physics.
civil,adj.公民的,All citizens have civil rights.
civil,adj.文明的,They had a civil conversation despite their disagreement.
fresh,adj.新鲜的,The bread is still fresh.
audience,n.观众,The audience cheered loudly.
shop,n.商店,She bought a dress at the shop.
shop,v.购物,They went shopping for new clothes.
agreement,n.协议,They reached an agreement after long talks.
victim,n.受害者,The victim of the accident was taken to the hospital.
function,n.功能,The main function of a phone is communication.
function,v.运作,The machine is not functioning properly.
link,n.连接,There is a strong link between diet and health.
link,v.连接,This bridge links the two cities together.
labor,n.劳动,Physical labor can be exhausting.
labor,v.努力工作,He labored day and night to finish the project.
majority,n.大多数,The majority of people like summer.
stone,n.石头,He picked up a stone and threw it into the river.
separate,v.分开,They decided to separate after years of marriage.
separate,adj.分开的,We live in separate apartments.
murder,n.谋杀,The police are investigating a murder case.
murder,v.谋杀,He was arrested for murdering his neighbor.
warm,adj.温暖的,The sun feels warm on my skin.
warm,v.使温暖,She warmed her hands by the fire.
nor,conj.也不,"He doesn’t like coffee, nor does he like tea."
western,adj.西方的,He is interested in Western culture.
responsibility,n.责任,It is your responsibility to take care of your pet.
straight,adv.直地,He walked straight to the door.
straight,adj.直的,Draw a straight line on the paper.
ring,n.戒指,She wears a gold ring on her finger.
ring,v.响铃,The phone rang loudly in the room.
secret,n.秘密,Can you keep a secret?
fun,n.乐趣,We had so much fun at the party.
born,v.出生,She was born in a small town.
bird,n.鸟,A bird is singing outside my window.
newspaper,n.报纸,He reads the newspaper every morning.
restaurant,n.餐厅,We had dinner at a fancy restaurant.
prevent,v.阻止,The seatbelt helps prevent serious injuries.
forest,n.森林,They walked through a dense forest.
citizen,n.公民,Every citizen has the right to vote.
welcome,v.欢迎,They warmly welcomed us to their home.
perfect,adj.完美的,Her performance was perfect.
corner,n.角落,He sat in the corner of the room.
suit,n.西装,He wore a black suit to the wedding.
suit,v.适合,This job suits him well.
relation,n.关系,The two countries have a good relation.
troop,n.部队,The troops were ready for battle.
customer,n.顾客,The customer asked for a refund.
speech,n.演讲,He gave a speech at the meeting.
speed,n.速度,The car moved at high speed.
paint,v.涂漆,They painted the wall blue.
crowd,n.人群,A large crowd gathered in the square.
conflict,n.冲突,The conflict between the two sides lasted for years.
rich,adj.富有的,He became rich through hard work.
examine,v.检查,The doctor examined the patient carefully.
nuclear,adj.核能的,The country is developing nuclear energy.
assume,v.假设,I assume he will be here soon.
screen,n.屏幕,She stared at the computer screen for hours.
pound,n.（重量单位）磅,This bag of rice weighs five pounds.
pound,v.猛击,He pounded on the door angrily.
therefore,adv.因此,"She was sick, therefore she stayed at home."
none,pron.没有一个,"I asked for help, but none came."
tear,n.眼泪,Tears rolled down her cheeks.
tear,v.撕裂,Be careful not to tear the paper.
successful,adj.成功的,She is a successful businesswoman.
round,adj.圆的,The table has a round shape.
round,n.一轮（比赛、活动等）,He reached the final round of the competition.
lady,n.女士,A kind lady helped me cross the street.
southern,adj.南方的,The weather is warm in southern countries.
favorite,adj.最喜欢的,Blue is my favorite color.
host,n.主持人,The TV show host is very funny.
host,v.招待,They will host a party this weekend.
neighborhood,n.社区,Our neighborhood is quiet and friendly.
safety,n.安全,"For your safety, wear a seatbelt."
publish,v.出版,He plans to publish his first book next year.
trust,v.信任,I trust my best friend completely.
sky,n.天空,The sky is full of stars tonight.
version,n.版本,I like the latest version of this app.
achieve,v.实现,She worked hard to achieve her dream.
attitude,n.态度,His attitude towards work is very positive.
admit,v.承认,He admitted that he made a mistake.
income,n.收入,Her monthly income is quite high.
blow,v.吹,The wind blew strongly last night.
blow,n.打击,Losing his job was a huge blow to him.
document,n.文件,She signed the document carefully.
lift,v.举起,He can lift a heavy box easily.
insurance,n.保险,He bought health insurance last year.
suffer,v.遭受,Many people suffered during the storm.
post,n.邮件,I received a post from my friend today.
post,v.发布,She posted a new photo on social media.
eventually,adv.最终,He eventually became a doctor.
sorry,adj.抱歉的,I'm sorry for being late.
dad,n.爸爸,My dad loves to cook.
due,adj.到期的,The payment is due next Monday.
jump,v.跳跃,The cat jumped over the fence.
opinion,n.意见,Everyone has a different opinion on this topic.
nobody,pron.没有人,Nobody knows the answer.
tour,n.旅行,They went on a tour around Europe last summer.
tour,v.旅游,We plan to tour the city by bike.
basic,adj.基本的,He needs to learn some basic math before the test.
independent,adj.独立的,She is an independent woman who runs her own business.
damage,n.损害,The storm caused severe damage to the buildings.
damage,v.损坏,The car was damaged in the accident.
primary,adj.主要的,The primary goal is to finish the project on time.
primary,adj.初级的,He is in primary school and loves reading books.
spread,v.传播,The news spread quickly across social media.
spread,v.涂抹,She spread butter on the toast.
conversation,n.谈话,They had a long conversation about their plans for the summer.
weekend,n.周末,I usually relax with friends on the weekend.
freedom,n.自由,"After years of struggle, the country gained its freedom."
refer,v.提到,She referred to her notes during the presentation.
refer,v.推荐,The doctor referred me to a specialist for treatment.
status,n.状态,Inspecting the status of steering wheel.
status,n.地位,The organization is concerned with the status of women in society.
village,n.村庄,They live in a small village near the mountains.
brain,n.大脑,The brain controls all the body's functions.
balance,n.平衡,She practiced yoga to improve her balance.
title,n.标题,The title of the book caught my attention.
title,n.头衔,He earned the title of champion after winning the race.
variety,n.种类,The store offers a wide variety of fruits and vegetables.
daily,adj.每日的,He follows a daily routine of exercise and work.
daily,adv.每日,She checks her email daily to stay updated.
plane,n.飞机,The plane took off smoothly from the airport.
dry,adj.干的,The clothes are dry after being in the sun.
dry,adj.枯燥的,The lecture was so dry that I almost fell asleep.
attend,v.参加,She will attend the meeting tomorrow.
attend,v.照顾,The nurse attended to the patient's needs.
winter,n.冬天,Winter is my favorite season because of the snow.
argument,n.争论,They had an argument about where to go for dinner.
argument,n.论点,His argument for the new policy was very convincing.
nine,num.九,There are nine apples in the basket.
announce,v.宣布,The principal will announce the winner at the assembly.
encourage,v.鼓励,The teacher encouraged the students to try their best.
concept,n.概念,The concept of time is difficult for young children to understand.
spirit,n.精神,The team showed great spirit during the game.
spirit,n.灵魂,Many cultures believe in the existence of the human spirit.
complex,adj.复杂的,The instructions were too complex for me to follow.
hole,n.洞,There is a hole in my sock.
immediately,adv.立即,He left the room immediately after the phone rang.
powerful,adj.强大的,The powerful engine made the car go very fast.
gold,n.黄金,She wore a beautiful gold necklace.
reporter,n.记者,The reporter asked the mayor about the new policy.
afternoon,n.下午,We went for a walk in the afternoon.
theater,n.剧院,We watched a play at the theater last night.
stress,n.压力,Too much stress can affect your health.
boat,n.船,We took a boat to cross the river.
league,n.联盟,The local teams formed a new football league.
internet,n.互联网,She found the recipe on the internet.
hide,v.隐藏,The cat likes to hide under the bed.
replace,v.替换,He decided to replace the old carpet with a new one.
