word,translation,sentence
nation,n.国家,The president spoke to the nation about the crisis.
nation,n.民族,The festival celebrates the traditions of the native nation.
matter,n.事情,This is a serious matter that needs attention.
matter,v.要紧,It doesn't matter if you're late; just come when you can.
send,v.发送,She will send an email to confirm the meeting time.
present,adj.现在的,"In the present situation, we need to stay calm."
present,n.礼物,He gave her a present for her birthday.
half,n. / adj. 一半,She ate half of the pizza and saved the rest for later.
color,n.颜色,Her favorite color is blue.
color,v.给...着色,The children love to color pictures in their books.
front,n.前面,The teacher stood at the front of the classroom.
front,adj.前面的,The front door was painted red.
act,v.行动,We need to act quickly to solve this problem.
act,n.行为,His act of kindness was appreciated by everyone.
someone,pron.某人,Someone left their bag in the classroom.
general,adj.一般的,The general opinion is that the movie was great.
general,n.将军,The general led the army to victory.
voice,n.声音,She has a very soft and calming voice.
interest,n.兴趣,She has a strong interest in art.
interest,n.利益,The new policy is in the public interest.
expect,v.期待,We expect the meeting to be short.
expect,v.预期,The company expects to grow next year.
design,v.设计,She designed a beautiful dress for the event.
design,n.设计,The design of the building is very modern.
field,n.田野,The cows are grazing in the field.
field,n.领域,He is an expert in the field of medicine.
kill,v.杀死,The hunter killed a deer.
death,n.死亡,The death of his dog made him very sad.
free,adj.自由的,The bird is free to fly in the sky.
free,adj.免费的,The coffee is free for customers.
price,n.价格,The price of the car is too high.
price,n.代价,The price of success is hard work.
cover,v.覆盖,She covered the table with a cloth.
cover,n.封面,The cover of the book is very colorful.
suggest,v.建议,He suggested that we leave early.
development,n.发展,The development of technology is rapid.
clear,adj.清晰的,The instructions were very clear.
clear,v.清除,Please clear the table after dinner.
increase,v.增加,The company plans to increase its staff.
increase,n.增长,There was a significant increase in sales.
former,adj.以前的,The former president gave a speech.
former,n.前者,"Of the two options, I prefer the former."
remain,v.保持,Please remain seated during the flight.
remain,v.剩余,Only a few apples remain in the basket.
class,n.班级,She is the best student in her class.
class,n.等级,This hotel is in a different class.
six,num.六,There are six apples on the table.
south,n.南方,Birds fly to the south in winter.
hit,v.击打,He hit the ball with a bat.
hit,v.达到,The movie hit a record in ticket sales.
model,n.模型,She built a model of the Eiffel Tower.
model,n.榜样,He is a role model for young athletes.
sign,n.标志,"The sign on the door says 'Exit'."
sign,v.签名,Please sign your name on the dotted line.
future,n.未来,We are planning for the future.
pull,v.拉,She pulled the door open.
arm,n.手臂,He broke his arm in the accident.
arm,n.武器,The soldiers were equipped with advanced arms.
require,v.需要,This job requires a lot of patience.
land,n.土地,They bought a piece of land to build a house.
land,v.着陆,The plane will land in ten minutes.
value,n.价值,The value of this painting is very high.
raise,v.提高,The company decided to raise salaries.
raise,v.养育,They raised their children in a small town.
role,n.角色,She played the role of a queen in the play.
role,n.作用,Education plays a key role in personal development.
police,n.警察,The police are investigating the accident.
else,adv.其他,"If you don't like this book, I can give you something else."
sell,v.出售,She decided to sell her old car to buy a new one.
leader,n.领导者,The team leader organized a meeting to discuss the project.
effort,n.努力,"With great effort, he finally finished the marathon."
drug,n.药物,The doctor prescribed a new drug for his patient.
drug,n.毒品,Using illegal drugs can have serious consequences.
season,n.季节,Autumn is my favorite season because of the cool weather.
tax,n.税,Every citizen must pay income tax to the government.
north,n.北方,The north of the country is known for its cold winters.
focus,v.集中,You need to focus on your studies to pass the exam.
focus,n.焦点,The focus of the discussion was on environmental protection.
perhaps,adv.也许,Perhaps we should wait a little longer before making a decision.
practice,n.练习,Regular practice is essential to improve your skills.
practice,v.练习,She practices the piano every day.
outside,adv.在外面,The children are playing outside in the garden.
project,n.项目,The company is working on a new project to develop renewable energy.
news,n.新闻,I watch the news every evening to stay informed.
relationship,n.关系,They have a strong relationship built on trust and respect.
fire,n.火,The fire destroyed the old building.
fire,v.解雇,The manager had to fire an employee for repeated misconduct.
wall,n.墙,She hung a beautiful painting on the wall.
sometimes,adv.有时,Sometimes I like to take a walk in the park.
possible,adj.可能的,It is possible to finish the project by tomorrow.
themselves,pron.他们自己,They cooked dinner themselves.
heart,n.心脏,Her heart was beating fast after the run.
heart,n.中心,The heart of the city is bustling with activity.
share,v.分享,She decided to share her cookies with her friends.
develop,v.发展,The company plans to develop new software.
order,n.顺序,Please arrange the books in alphabetical order.
order,v.命令,The officer ordered the soldiers to stand at attention.
either,adv.也,"I don't like coffee, and I don't like tea either."
either,conj.或者,You can either stay here or come with us.
strong,adj.强壮的,He is strong enough to lift the heavy box.
wife,n.妻子,His wife is a teacher at the local school.
decide,v.决定,She couldn't decide which dress to wear.
inside,prep.在...里面,The keys are inside the drawer.
pick,v.挑选,He picked the red shirt from the closet.
easy,adj.容易的,This math problem is very easy to solve.
federal,adj.联邦的,The federal government announced new policies.
position,n.位置,The position of the lamp is perfect for reading.
position,n.职位,She applied for a managerial position at the company.
decision,n.决定,She made the decision to move to another city.
difference,n.差异,There is a big difference between these two books.
international,adj.国际的,He works for an international company.
approach,v.接近,The cat slowly approached the bird.
approach,n.方法,We need a new approach to solve this problem.
patient,adj.耐心的,The teacher was very patient with the students.
patient,n.病人,The doctor is taking care of a patient now.
ground,n.地面,He sat on the ground to rest.
church,n.教堂,They got married in a small church.
star,n.星星,We saw many stars in the sky last night.
star,n.明星,She is a famous movie star.
player,n.运动员,He is a talented basketball player.
player,n.播放器,The CD player is not working.
wave,v.挥手,She waved at her friend from the bus.
wave,n.波浪,The waves were very high at the beach.
son,n.儿子,Their son is studying abroad.
town,n.小镇,They live in a quiet town near the mountains.
wear,v.穿着,She likes to wear red dresses.
road,n.道路,The road to the village is very narrow.
full,adj.满的,The glass is full of water.
join,v.加入,He decided to join the club.
explain,v.解释,Can you explain how this machine works?
director,n.导演,The director is very famous for his movies.
director,n.主管,She is the director of the company.
fight,v.打架,The two boys started to fight over the toy.
fight,v.斗争,They fought for their rights.
society,n.社会,We live in a modern society.
receive,v.收到,I received a gift from my friend.
couple,n.夫妻,The couple went on a vacation together.
couple,n.几个,I have a couple of books to read.
true,adj.真实的,It is true that she won the competition.
action,n.行动,We need to take action to solve this problem.
action,n.动作,The movie is full of exciting actions.
carry,v.携带,She carries a bag to school every day.
carry,v.搬运,He carried the box to the car.
data,n.数据,The scientist analyzed the data carefully.
space,n.空间,There is not enough space in this room.
space,n.太空,The rocket was launched into space.
building,n.建筑物,The building is very tall.
activity,n.活动,We have many activities at school.
oil,n.油,She cooked the food with olive oil.
soon,adv.很快,He will arrive soon.
special, adj. 特别的, This is a special gift for you.
special, adj. 专用的, He has a special seat in the front row.
agree, v. 同意, I agree with your opinion on this matter.
agree, v. 达成一致, We agreed on the meeting time.
especially, adv. 尤其, "I like fruits, especially apples."
security, n. 安全, The building has strong security.
rule, n. 规则, There are strict rules in the classroom.
rule, v. 统治, The king ruled the country for 40 years.
plant, n. 工厂, The company has a new plant in the city.
plant, n. 植物, She watered the plants in her garden.
produce, v. 生产, The factory produces cars.
produce, n. 农产品, The market sells fresh produce.
picture, n. 图片, She showed me a picture of her family.
instead, adv. 代替, He decided to stay home instead of going out.
event, n. 事件, The wedding was a beautiful event.
phone, n. 电话, I need to charge my phone.
phone, v. 打电话, I'll phone you when I get home.
rest, n. 休息, He took a short rest after the long walk.
rest, v. 休息, You should rest for a while.
everyone, pron. 每个人, Everyone in the class was excited about the trip.
paper, n. 纸, Please write your name on the paper.
paper, n. 报纸, I read an interesting article in the paper today.
likely, adj. 可能的, It is likely to rain tomorrow.
likely, adv. 很可能, She will likely arrive late.
bit, n. 小块, He took a bit of the chocolate cake.
bit, adv. 稍微, I’m a bit tired after the long meeting.
attack,v.攻击,The enemy attacked the city at dawn.
attack,n.攻击,The terrorist attack caused a lot of damage.
vote,v.投票,She voted for the new policy.
vote,n.投票,There were 500 votes in favor of the plan.
catch,v.抓住,The dog caught the ball in mid-air.
catch,v.赶上,I didn't catch the bus this morning.
west,n.西方,The sun sets in the west.
charge,v.收费,The hotel charged me for the extra night.
charge,v.指控,He was charged with theft.
whose,pron.谁的,Whose book is this on the table?
eat,v.吃,We eat lunch at noon.
teach,v.教,She teaches English at the local school.
subject,n.主题,The subject of the meeting was the new project.
subject,n.学科,Math is my favorite subject.
measure,v.测量,The doctor will measure your height and weight.
measure,n.措施,The government has taken strong measures to fight pollution.
press,v.按压,He pressed the button to start the machine.
press,n.新闻,The press reported the incident widely.
situation,n.情况,The situation in the country is improving.
rise,v.上升,The sun rises in the east.
rise,n.上升,There was a rise in temperature yesterday.
industry,n.工业,The car industry is growing rapidly.
industry,n.行业,She works in the fashion industry.
above,prep.在…之上,The picture hangs above the fireplace.
above,adj.上述的,"As mentioned above, we will have a meeting tomorrow."
type,n.类型,What type of music do you like?
type,v.打字,She types very fast on the keyboard.
describe, v. 描述, She asked him to describe the scene in detail.
risk, n. 风险, There is a risk of injury in this sport.
risk, v. 冒险, He risked his life to save the child.
near, adj. 近的, The store is near my house.
near, prep. 在...附近, There is a park near the school.
recent, adj. 最近的, He joined the company in recent months.
middle, n. 中间, The book is in the middle of the table.
middle, adj. 中等的, The middle road is the safest.
hair, n. 头发, She has long brown hair.
itself, pron. 它自己, The dog cleaned itself after the walk.
standard, n. 标准, The company has high quality standards.
standard, adj. 标准的, He followed the standard procedure.
piece, n. 一片, She cut a piece of cake for me.
piece, n. 一件, This is a beautiful piece of artwork.
technology, n. 科技, The new technology changed the industry.
worker, n. 工人, The workers are building a new bridge.
film, n. 电影, They watched a film at the cinema last night.
product, n. 产品, The company launched a new product last month.
product, n. 产物, The product of the experiment was surprising.
smile, n. 微笑, She gave me a warm smile when I arrived.
smile, v. 微笑, He smiled at the funny joke.
doctor, n. 医生, The doctor helped me with my injury.
doctor, n. 博士, He is a doctor in physics.
quite, adv. 相当, The book is quite interesting.
green, adj. 绿色的, The park is full of green trees.
race, n. 竞赛, She won the race easily.
race, n. 种族, The race issue is still a topic of discussion.
drop, v. 丢下, Please drop the package at my office.
drop, n. 水滴, A drop of water fell from the leaf.
campaign, n.运动, The environmental campaign aimed to reduce plastic waste.
movie, n.电影, We watched a great movie last night.
visit, v.拜访, I will visit my grandparents this weekend.
visit, n.访问, He paid a visit to the museum yesterday.
short, adj.短的, The movie was too short; it ended quickly.
short, adj.缺乏的, The team was short of players for the game.
list, n.清单, I made a list of things to do today.
list, v.列出, Can you list all the books you’ve read?
wrong, adj.错误的, That answer is wrong; try again.
wrong, adj.不对劲的, Something feels wrong with my computer.
personal, adj.个人的, "This is a personal matter, so I won’t talk about it."
certain, adj.确定的, I’m certain she will pass the exam.
certain, adj.某些, There are certain rules we need to follow.
draw, v.画, He likes to draw pictures in his free time.
draw, v.吸引, The event will draw many visitors to the city.
window, n.窗户, She opened the window to let in some fresh air.
baby, n.婴儿, The baby smiled at me.
department, n.部门, She works in the marketing department.
department, n.学科, He is studying in the history department.
third, adj.第三, She finished in third place in the race.
organization, n.组织, The charity organization raised a lot of money.
organization, n.结构, The organization of the book was very clear.
single, adj.单一的, He bought a single ticket for the concert.
single, adj.未婚的, She is a single mother.
bank, n.银行, I need to go to the bank to withdraw some money.
bank, n.河岸, The children played by the bank of the river.
red, adj.红色的, She wore a beautiful red dress.
evidence, n.证据, The police found evidence at the crime scene.
evidence, n.迹象, There is no evidence to support the claim.
tree, n.树, We sat under the tree to rest.
culture,n.文化,The culture of this country is very rich and diverse.
culture,n.耕作,The farmers are learning about modern farming culture.
store,n.商店,She bought a new dress at the store.
store,v.储存,The data is stored on the hard drive.
simply,adv.仅仅,He simply asked for a glass of water.
simply,adv.简单地,You can simply click the button to start.
average,n.平均,The average age of the students is 20.
average,adj.普通的,His performance was average at best.
computer,n.计算机,She works with computers every day.
listen,v.听,Please listen carefully to the instructions.
energy,n.能量,She has a lot of energy after the workout.
energy,n.精力,He has the energy to work long hours.
pretty,adj.漂亮的,She looks pretty in that dress.
pretty,adv.相当,The weather is pretty cold today.
nearly,adv.几乎,He nearly missed the train.
nearly,adv.差不多,The building is nearly finished.
check,v.检查,Please check the list before you leave.
check,n.支票,He paid with a check at the counter.
attention,n.注意,Please pay attention to the road signs.
attention,n.关注,The new product got a lot of attention in the media.
key,n.钥匙,He forgot his house key at home.
key,n.关键,Understanding this concept is the key to solving the problem.
century,n.世纪,The Eiffel Tower was built in the 19th century.
century,n.百年,They celebrated the 100th anniversary of the company.
condition,n.条件,The car is in excellent condition.
condition,n.情况,His health condition has improved a lot.
dark,adj.黑暗的,It was too dark to see anything.
dark,adj.阴沉的,The sky turned dark before the rain.
benefit,n.好处,Regular exercise has many health benefits.
benefit,n.福利,The company offers health benefits to its employees.
private,adj.私人的,They had a private meeting to discuss the project.
private,adj.隐私的,She values her private life very much.
chance,n.机会,He got the chance to travel abroad.
chance,n.可能性,There is a good chance of rain tomorrow.
choose,v.选择,I will choose the blue shirt.
choose,v.挑选,You can choose your own seat in the cinema.
summer,n.夏天,We usually go to the beach during the summer.
brother,n.兄弟,My brother is older than me by two years.
period,n.一段时间,She studied for a period of three hours without a break.
period,n.句号,Remember to put a period at the end of your sentence.
concern,n.关心,His main concern is the health of his family.
concern,v.涉及,This problem concerns all of us.
population,n.人口,The population of the city has grown rapidly.
difficult,adj.困难的,It is difficult to learn a new language.
wonder,v.想知道,I wonder what time the meeting will start.
available,adj.可用的,Is this seat available?
term,n.学期,The new term starts in September.
term,n.术语,This is a technical term used in biology.
trade,n.贸易,International trade is important for the economy.
trade,v.交换,He traded his sandwich for a piece of cake.
judge,n.法官,The judge made a fair decision.
judge,v.判断,It's hard to judge a book by its cover.
administration,n.管理,The administration of the company is very efficient.
board,n.木板,He cut the board into smaller pieces.
board,n.董事会,The board will meet next week to discuss the budget.
science,n.科学,She has always been interested in science.
floor,n.地板,Please clean the floor before you leave.
floor,n.楼层,Her office is on the fifth floor.
realize,v.意识到,I didn't realize how late it was.
deep,adj.深的,The water in the lake is very deep.
challenge,n.挑战,Climbing the mountain was a big challenge.
lie,v.躺,He decided to lie down and rest for a while.
lie,v.说谎,She didn't want to lie to her friend.
sport,n.运动,Football is a popular sport around the world.
material,n.材料,This material is very durable.
page,n.页,He flipped to the next page of the book.
per,prep.每,The speed limit is 60 miles per hour.
throw,v.投掷,He can throw a baseball very far.
billion,n.十亿,The company made over a billion dollars last year.
range,n.范围,The test covers a wide range of topics.
daughter,n.女儿,She took her daughter to the park.
push,v.推,He helped push the car when it broke down.
fear,n.害怕,She has a fear of heights.
husband,n.丈夫,Her husband cooks dinner every night.
letter,n.信,She wrote a letter to her friend.
choice,n.选择,You have to make a choice between the two options.
score,n.分数,He got a high score on the test.
author,n.作者,She is the author of a famous novel.
bed,n.床,He lay down on the bed to rest.
interview,n.面试,He prepared well for the job interview.
medical,adj.医学的,She is studying at a medical school.
myself,pron.我自己,I can do it by myself.
east,n.东方,The sun rises in the east.
performance,n.表现,Her performance at work has been excellent.
performance,n.表演,The band's live performance was amazing.
goal,n.目标,His goal is to become a doctor.
goal,n.进球,He scored the winning goal in the final match.
address,n.地址,Please write down your home address.
address,v.演讲,The president will address the nation tonight.
dead,adj.死亡的,The plant is dead because of lack of water.
blue,adj.蓝色的,She wore a beautiful blue dress.
blue,adj.忧郁的,He felt blue after hearing the bad news.
certainly,adv.当然,"Can you help me?" "Certainly!"
common,adj.常见的,It is common to see tourists here.
hospital,n.医院,He was taken to the hospital after the accident.
officer,n.官员,The officer checked our passports.
anyone,pron.任何人,Does anyone know the answer?
total,adj.总的,The total cost is $50.
represent,v.代表,She will represent our school in the competition.
nature,n.自然,She loves spending time in nature.
seek,v.寻找,He is seeking a new job.
complete,adj.完整的,The project is now complete.
complete,v.完成,She completed the assignment on time.
fill,v.填充,Please fill the bottle with water.
alone,adj.独自的,She felt alone in the big city.
fine,adj.好的,The weather is fine today.
fine,n.罚款,He had to pay a fine for speeding.
reduce,v.减少,We need to reduce plastic waste.
coach,n.教练,The coach gave the team a great speech.
coach,n.长途汽车,We traveled to the city by coach.
foreign,adj.外国的,She loves learning foreign languages.
agency,n.代理机构,She works for a travel agency.
laugh,v.笑,The joke made everyone laugh.
left,adj.左边的,Turn left at the next corner.
left,v.离开,He left the party early.
upon,prep.在……之上,The book was placed upon the table.
cup,n.杯子,She drank a cup of tea.
movement,n.运动,The movement for equality is growing.
language,n.语言,English is a widely spoken language.
blood,n.血液,The doctor checked his blood pressure.
save,v.拯救,The firefighter saved the child from the fire.
save,v.节省,She wants to save more money this year.
account,n.账户,He opened a bank account.
account,n.描述,He gave an account of what happened.
beyond,prep.超出,The mountains are beyond the river.
thus,adv.因此,"He was late, thus he missed the meeting."
natural,adj.自然的,She prefers natural beauty products.
shoot,v.射击,The hunter aimed and shot at the target.
shoot,v.拍摄,They are shooting a new movie in the city.
demand,v.要求,The workers demanded higher wages.
demand,n.需求,There is a high demand for electric cars.
article,n.文章,She wrote an interesting article about climate change.
article,n.物品,This store sells household articles.
particular,adj.特定的,He is looking for a particular type of book.
particular,adj.挑剔的,She is very particular about her food.
hot,adj.热的,The coffee is too hot to drink.
hot,adj.辣的,He loves eating hot and spicy food.
analysis,n.分析,The scientist conducted a detailed analysis of the data.
travel,v.旅行,They love to travel around the world.
decade,n.十年,She has been working here for over a decade.
rock,n.岩石,The climber grabbed onto a large rock.
rock,n.摇滚音乐,He enjoys listening to rock music.
staff,n.员工,The company hired new staff last month.
attempt,v.尝试,She attempted to lift the heavy box.
enter,v.进入,He entered the room quietly.
chief,adj.主要的,His chief concern is safety.
chief,n.首领,The chief of the tribe made an announcement.
ready,adj.准备好的,I am ready for the test.
treatment,n.治疗,The patient received medical treatment.
treatment,n.对待,He complained about his unfair treatment at work.
cold,adj.寒冷的,It is very cold outside in winter.
cold,n.感冒,She caught a bad cold last week.
amount,n.数量,He spent a large amount of money on the car.
dog,n.狗,Her dog is very friendly.
poor,adj.贫穷的,Many poor families need financial help.
poor,adj.糟糕的,His performance was very poor.
artist,n.艺术家,The artist painted a beautiful landscape.
similar,adj.相似的,These two paintings look very similar.
exactly,adv.准确地,She knows exactly what to do.
pressure,n.压力,He felt a lot of pressure before the exam.
size,n.尺寸,What size shoes do you wear?
forward,adv.向前,She took a step forward.
firm,adj.坚固的,The bed has a firm mattress.
firm,n.公司,She works for a big law firm.
sort,n.种类,What sort of music do you like?
animal,n.动物,A tiger is a wild animal.
usually,adv.通常,He usually wakes up at 7 AM.
herself,pron.她自己,She made the cake herself.
sleep,n.睡眠,He needs eight hours of sleep every night.
sleep,v.睡觉,The baby is sleeping peacefully.
happy,adj.高兴的,She was very happy to see her friend.
final,adj.最终的,This is my final decision.
river,n.河流,The river flows into the sea.
dream,n.梦想,Her dream is to become a doctor.
dream,v.做梦,He dreamed about flying last night.
ahead,adv.在前面,We have a long journey ahead.
central,adj.中心的,The hotel is in a central location.
physical,adj.身体的,Regular exercise is good for physical health.
seven,num.七,There are seven days in a week.
guess,v.猜测,Can you guess what’s in the box?
media,n.媒体,The news media reported the event widely.
quality,n.质量,This product is of high quality.
quality,n.品质,Honesty is an important quality in a friend.
occur,v.发生,The accident occurred late at night.
spring,n.春天,Flowers bloom in spring.
spring,n.泉水,The village has a natural spring.
hundred,n.一百,She has read a hundred books.
glass,n.玻璃,The window is made of glass.
glass,n.杯子,He drank a glass of water.
determine,v.决定,Your effort will determine your success.
ability,n.能力,She has the ability to solve problems quickly.
male,adj.男性的,Only male birds have bright feathers.
box,n.盒子,She kept her jewelry in a small box.
box,n.箱子,He packed his clothes in a big box.
disease,n.疾病,Scientists are working to cure the disease.
